{
    "$schema": "../../../src/schemas/package.schema.json",
    "name": "zustand",
    "displayName": "Zustand",
    "description": "Small, fast and scalable state-management solution",
    "version": "^4.4.7",
    "frameworks": ["react-vite", "tanstack-start"],
    "isUILibrary": false,
    "isIconLibrary": false,
    "canBeSharedPackage": false
}
