{
    "$schema": "../../../src/schemas/package.schema.json",
    "name": "better-auth",
    "displayName": "Better Auth",
    "description": "Modern authentication solution with built-in security features",
    "version": "^1.0.0",
    "dependencies": ["better-auth@^1.2.7"],
    "devDependencies": [],
    "frameworks": ["react-vite", "tanstack-start"],
    "isUILibrary": false,
    "isIconLibrary": false,
    "canBeSharedPackage": true,
    "sharedPackageDefaultName": "auth",
    "configOptions": {
        "prompt": {
            "type": "checkbox",
            "message": "Which authentication strategy would you like to use?",
            "choices": [
                {
                    "name": "Email & Password - Traditional authentication",
                    "value": "email-password"
                },
                { "name": "Google - Social sign-in with Google", "value": "google" },
                { "name": "Facebook - Social sign-in with Facebook", "value": "facebook" }
            ],
            "default": "email-password"
        }
    }
}
