{
    "$schema": "../../../src/schemas/package.schema.json",
    "name": "@astrojs/i18n",
    "displayName": "Astro i18n Integration",
    "description": "Internationalization for Astro",
    "version": "^2.3.0",
    "frameworks": ["astro-vite"],
    "isUILibrary": false,
    "isIconLibrary": false,
    "canBeSharedPackage": false
}
