{
    "$schema": "../../../src/schemas/package.schema.json",
    "name": "astro:transitions",
    "displayName": "Astro View Transitions",
    "description": "Add smooth transitions between pages",
    "version": "built-in",
    "frameworks": ["astro-vite"],
    "isUILibrary": false,
    "isIconLibrary": false,
    "canBeSharedPackage": false
}
