{
    "$schema": "../../../src/schemas/package.schema.json",
    "name": "@iconscout/react-unicons",
    "displayName": "Unicons",
    "description": "Pixel-perfect vector icons",
    "version": "^2.0.2",
    "frameworks": ["react-vite", "tanstack-start"],
    "isUILibrary": false,
    "isIconLibrary": true,
    "canBeSharedPackage": false
}
