{
    "$schema": "../../../src/schemas/package.schema.json",
    "name": "@astrojs/tailwind",
    "displayName": "Astro Tailwind Integration",
    "description": "Use Tailwind CSS in Astro",
    "version": "^5.1.0",
    "frameworks": ["astro-vite"],
    "isUILibrary": false,
    "isIconLibrary": false,
    "canBeSharedPackage": false,
    "devDependencies": ["tailwindcss@^3.4.0", "postcss@^8.4.32", "autoprefixer@^10.4.16"]
}
