{
    "$schema": "../../../src/schemas/package.schema.json",
    "name": "clsx",
    "displayName": "clsx",
    "description": "A tiny utility for constructing className strings conditionally",
    "version": "^2.0.0",
    "frameworks": ["react-vite", "tanstack-start", "astro-vite"],
    "isUILibrary": false,
    "isIconLibrary": false,
    "canBeSharedPackage": false
}
