{
    "$schema": "../../../src/schemas/package.schema.json",
    "name": "@chakra-ui/react",
    "displayName": "Chakra UI",
    "description": "Simple, modular and accessible UI components",
    "version": "^2.8.2",
    "dependencies": [
        "@chakra-ui/react@^2.8.2",
        "@emotion/react@^11.11.3",
        "@emotion/styled@^11.11.0",
        "framer-motion@^10.17.9"
    ],
    "frameworks": ["react-vite", "tanstack-start"],
    "isUILibrary": true,
    "isIconLibrary": false,
    "canBeSharedPackage": false
}
