{
    "$schema": "../../../src/schemas/package.schema.json",
    "name": "lucide-react",
    "displayName": "Lucide",
    "description": "Beautiful & consistent icons",
    "version": "^0.303.0",
    "frameworks": ["react-vite", "tanstack-start"],
    "isUILibrary": false,
    "isIconLibrary": true,
    "canBeSharedPackage": false
}
