{
    "$schema": "../../../src/schemas/package.schema.json",
    "name": "date-fns",
    "displayName": "date-fns",
    "description": "Modern JavaScript date utility library",
    "version": "^3.3.1",
    "frameworks": [],
    "isUILibrary": false,
    "isIconLibrary": false,
    "canBeSharedPackage": false
}
