{
    "$schema": "../../../src/schemas/package.schema.json",
    "name": "@shadcn/ui",
    "displayName": "shadcn/ui",
    "description": "Re-usable components built using Radix UI and Tailwind CSS",
    "version": "latest",
    "isDev": true,
    "dependencies": [
        "@radix-ui/react-icons@^1.3.0",
        "class-variance-authority@^0.7.0",
        "clsx@^2.1.0",
        "tailwind-merge@^2.2.0"
    ],
    "devDependencies": [
        "@types/node@^20.10.0",
        "autoprefixer@^10.4.16",
        "postcss@^8.4.32",
        "tailwindcss@^3.4.0",
        "tailwindcss-animate@^1.0.7"
    ],
    "frameworks": ["react-vite", "tanstack-start"],
    "isUILibrary": true,
    "isIconLibrary": false,
    "canBeSharedPackage": false
}
