{
    "$schema": "../../../src/schemas/package.schema.json",
    "name": "@mui/material",
    "displayName": "Material UI",
    "description": "Google's Material Design implementation for React",
    "version": "^5.15.2",
    "dependencies": [
        "@mui/material@^5.15.2",
        "@emotion/react@^11.11.3",
        "@emotion/styled@^11.11.0",
        "@mui/icons-material@^5.15.2"
    ],
    "frameworks": ["react-vite", "tanstack-start"],
    "isUILibrary": true,
    "isIconLibrary": false,
    "canBeSharedPackage": false
}
